foodname,portiondesc,Protein,Total Fat,Carbohydrate,Total Sugar,Dietary Fiber,Saturated Fat,Calcium,Sodium
"Milk, whole",cup,7.69,7.93,11.71,12.32,0.00,4.55,275.71,104.92
"Milk, whole, calcium fortified",cup,7.78,8.03,11.86,12.47,0.00,4.61,279.11,106.21
2% milk,cup,8.05,4.83,11.71,12.35,0.00,3.07,292.79,114.68
1% acidophilus milk,cup,8.16,2.35,12.08,12.58,0.00,1.53,302.49,106.48
2% acidophilus milk,cup,8.08,4.85,11.76,12.40,0.00,3.08,294.00,115.15
Fat free milk ,cup,8.26,0.20,12.15,12.47,0.00,0.14,298.90,102.90
"1% milk, lactose-free (Lactaid)",cup,8.29,2.39,12.27,12.79,0.00,1.56,307.49,108.24
"1% milk, lactose-free (Lactaid), calcium-fortified",cup,8.32,2.40,12.33,12.84,0.00,1.56,308.75,108.68
"Fat free milk, lactose-free",cup,8.26,0.20,12.15,12.47,0.00,0.14,298.90,102.90
"Fat free milk, lactose-free, calcium fortified",cup,8.40,0.44,11.98,11.98,0.00,0.29,503.88,128.44
"2% milk, lactose-free (Lactaid)",cup,8.05,4.83,11.71,12.35,0.00,3.07,292.79,114.68
"Lactaid milk, whole milk",cup,7.69,7.93,11.71,12.32,0.00,4.55,275.71,104.92
"Buttermilk, fat free (skim)",cup,8.11,2.16,11.74,11.74,0.00,1.34,284.20,465.50
1% buttermilk,cup,8.11,2.16,11.74,11.74,0.00,1.34,284.20,465.50
2% buttermilk,cup,10.04,4.90,12.98,12.98,0.00,3.04,350.35,257.25
Goat's milk ,cup,8.69,10.10,10.86,10.86,0.00,6.51,326.95,122.00
"Milk, dry, whole, reconstituted",cup,7.91,8.03,11.54,11.54,0.00,5.03,280.59,119.56
"Milk, dry, fat free, reconstituted",cup,7.99,0.17,11.88,11.88,0.00,0.11,286.65,134.75
"Buttermilk, dry, reconstituted",cup,8.23,1.40,11.76,11.76,0.00,0.86,291.55,132.30
"Evaporated milk, whole",cup,17.16,19.05,25.30,25.30,0.00,11.57,657.72,267.12
"Evaporated milk, reduced fat (2%)",cup,18.70,4.94,28.10,28.10,0.00,3.06,718.20,284.76
"Evaporated milk, fat free (skim) ",cup,19.33,0.51,29.06,29.06,0.00,0.31,742.40,294.40
Condensed milk ,cup,24.20,26.62,166.46,166.46,0.00,16.79,869.04,388.62
"Milk, soy (soy beverage)",cup,6.44,3.63,12.23,8.99,0.49,0.50,289.10,115.15
Light soymilk ,cup,5.78,1.87,8.53,6.34,0.73,0.01,298.89,116.64
Chocolate soymilk ,cup,5.42,3.67,23.88,18.86,0.96,0.58,290.39,127.19
Light chocolate soymilk ,cup,5.10,1.56,20.02,17.33,1.70,0.08,298.89,111.78
"Milk, soy (soy beverage), fat free (nonfat), chocolate",cup,6.00,0.10,20.68,8.87,0.49,0.00,281.88,138.51
"Yogurt, plain, whole milk",container (8 oz),7.88,7.38,10.58,10.58,0.00,4.76,274.67,104.42
"Yogurt, plain, fat free",container (8 oz),13.01,0.41,17.43,17.43,0.00,0.26,451.73,174.79
"Yogurt, coffee, whole milk",cup,11.86,7.69,33.17,33.17,0.00,4.85,411.60,159.25
"Yogurt, coffee, whole milk",container (8 oz),10.99,7.13,30.74,30.74,0.00,4.50,381.36,147.55
"Yogurt, coffee, lowfat",cup,12.08,3.06,33.81,33.81,0.00,1.97,418.95,161.70
"Yogurt, coffee, lowfat",container (8 oz),11.19,2.84,31.33,31.33,0.00,1.83,388.17,149.82
"Yogurt, coffee, fat free",cup,10.39,0.39,40.33,40.28,0.00,0.26,372.40,149.45
"Yogurt, coffee, fat free",container (8 oz),9.62,0.36,37.36,37.32,0.00,0.24,345.04,138.47
"Yogurt, coffee, light (fat free, low calorie sweetener)",cup,9.46,0.44,18.38,18.38,0.00,0.28,350.35,144.55
"Yogurt, coffee, light (fat free, low calorie sweetener)",container (8 oz),8.76,0.41,17.03,17.03,0.00,0.26,324.61,133.93
"Chocolate yogurt, whole milk",cup,8.40,7.55,55.86,35.55,2.94,4.70,208.25,320.95
"Chocolate yogurt, whole milk",container (6 oz),5.83,5.24,38.76,24.67,2.04,3.26,144.50,222.70
"Chocolate yogurt, whole milk",container (8 oz),7.79,6.99,51.76,32.94,2.72,4.35,192.95,297.37
"Chocolate yogurt, fat free",6 oz container,6.00,0.00,40.00,25.45,2.04,0.00,149.60,229.50
"Yogurt, blueberry, whole milk",container (6 oz),7.28,5.44,31.69,31.69,0.00,3.43,253.30,96.90
"Yogurt, blueberry, whole milk",container (8 oz),9.72,7.26,42.31,42.31,0.00,4.57,338.23,129.39
"Yogurt, blueberry, lowfat",container (8 oz),9.92,2.45,43.24,43.24,0.00,1.58,345.04,131.66
"Yogurt, blueberry, lowfat, low calorie sweetener",container (8 oz),11.03,3.20,42.22,6.58,0.00,2.06,345.04,131.66
"Yogurt, blueberry, fat free",container (8 oz),9.99,0.45,43.13,43.13,0.00,0.27,345.04,131.66
"Yogurt, blueberry, light (fat free, low calorie sweetener)",container (6 oz),6.36,0.29,13.40,11.85,0.68,0.16,227.80,90.10
Fruit and low fat yogurt parfait,McDonald's parfait,5.01,1.50,23.63,17.40,1.64,0.78,156.45,73.01
"Frozen yogurt, chocolate, low fat",cup,10.48,3.90,43.58,37.64,3.20,2.44,312.00,116.00
"Frozen yogurt, other flavors, low fat",cup,8.92,2.64,41.96,41.90,0.00,1.70,312.00,120.00
"Frozen yogurt, chocolate, nonfat",cup,7.00,1.27,31.32,20.05,3.18,0.80,252.81,128.79
"Frozen yogurt, other flavors, with sorbet",Haagen-Dazs bar (2.3 fl oz),2.78,2.56,20.01,15.55,0.38,1.54,85.50,39.75
"Frozen yogurt, other flavors, nonfat",cup,7.01,0.00,44.42,14.02,11.77,0.00,233.73,174.90
"Frozen yogurt, chocolate, nonfat, low-calorie sweetener",cup,8.18,1.49,36.64,23.45,3.72,0.94,295.74,150.66
"Frozen yogurt, other flavors, nonfat, low-calorie sweetener",cup,8.18,1.49,36.64,23.45,3.72,0.91,295.74,150.66
"Frozen yogurt, chocolate, whole milk",cup,5.22,6.26,37.58,33.48,4.00,3.95,174.00,109.62
"Frozen yogurt, other flavors, whole milk",cup,5.22,6.26,37.58,34.66,0.00,4.05,174.00,109.62
"Frozen yogurt, chocolate-coated",bar,1.32,6.73,11.86,11.65,0.08,5.34,45.92,27.88
"Frozen yogurt, carob-coated",bar,2.02,4.66,12.87,10.77,0.37,3.75,73.39,37.31
"Frozen yogurt, sandwich",sandwich,3.94,4.36,32.03,22.01,0.34,2.35,95.20,56.95
"Frozen yogurt, cone, chocolate",medium cone,6.08,10.76,37.01,26.37,1.77,6.38,152.21,125.07
"Frozen yogurt, cone, other flavors",medium cone,5.29,6.35,37.17,28.55,0.24,3.63,154.57,133.33
"Frozen yogurt, cone, other flavors, low fat",medium cone,6.39,2.19,13.30,8.24,0.24,1.20,205.30,95.57
"Frozen yogurt, cone, chocolate, low fat",medium cone,6.37,2.64,29.67,21.32,1.89,1.44,174.63,82.59
"Chocolate milk, whole",cup,7.92,8.48,25.85,23.85,2.00,5.26,280.00,150.00
"Chocolate milk, reduced fat (2%)",cup,7.48,4.75,30.33,23.88,1.75,2.94,272.50,165.00
"Chocolate milk, fat free (skim)",cup,8.55,0.70,27.35,25.38,1.25,0.44,287.50,97.50
"Chocolate milk, low fat (1%)",cup (school milk carton),8.10,2.50,31.50,24.85,1.25,1.54,290.00,152.50
"Hot chocolate, homemade, with whole milk",cup,8.48,8.33,30.35,27.15,2.25,4.79,265.00,100.00
"Hot chocolate, Puerto Rican style, with whole milk",cup,9.77,16.75,25.25,23.42,1.20,10.03,352.79,148.79
"Hot chocolate, Puerto Rican style, with reduced fat (2%) milk",cup,5.06,9.43,18.41,16.92,1.20,5.67,165.59,69.60
"Hot chocolate, Puerto Rican style, with low fat (1%) milk",cup,5.16,8.14,18.65,17.09,1.20,4.86,170.39,64.80
"Hot chocolate, (Hershey's), (Nestle's Quick), made from mix, with whole milk ",cup,8.18,7.92,29.67,28.50,1.00,4.75,352.50,127.50
"Hot chocolate, (Hershey's), (Nestle's Quick), made from mix, with reduced fat (2%) milk ",cup,8.50,5.00,29.67,28.53,1.00,3.35,370.00,135.00
"Hot chocolate, (Hershey's), (Nestle's Quick), made from mix, with low fat (1%) milk ",cup,8.68,2.70,30.10,28.85,1.00,1.92,380.00,130.00
"Hot chocolate, (Hershey's), (Nestle's Quick), made from mix, with fat free (skim) milk ",cup,8.68,0.65,29.98,28.53,1.00,0.60,372.50,125.00
"Chocolate milk, homemade, with whole milk ",cup,7.52,7.43,32.13,27.50,0.75,4.21,250.00,117.50
"Chocolate milk, homemade, with reduced fat (2%) milk ",cup,7.85,4.68,32.13,27.53,0.75,2.89,265.00,125.00
"Chocolate milk, homemade, with low fat (1%) milk ",cup,8.00,2.48,32.55,27.85,0.75,1.55,275.00,120.00
"Chocolate milk, homemade, with fat free (skim) milk ",cup,8.00,0.55,32.40,27.55,0.75,0.30,270.00,115.00
"Hot chocolate, (Swiss Miss), (Carnation), made from dry mix (with milk & sugar), with water",cup,2.30,1.38,28.82,22.55,1.25,0.82,52.50,182.50
"Hot chocolate, (Swiss Miss), (Carnation), made from dry mix (with milk & sugar), with water","packet dry mix, prepared with water",1.90,1.13,23.75,18.58,1.03,0.67,43.26,150.38
"Hot chocolate, (Carnation), (Swiss Miss), (Nutrisystem), made from mix (with milk & low calorie sweetener), with water",cup,3.03,0.58,14.03,7.35,1.50,0.35,120.00,180.00
"Hot chocolate, (Carnation), (Swiss Miss), (Nutrisystem), made from mix (with milk & low calorie sweetener), with water","packet dry mix, prepared with water",2.38,0.45,11.05,5.79,1.18,0.27,94.56,141.84
Ovaltine sugar free Hot Cocoa ,cup,3.83,0.45,8.86,8.49,0.25,0.27,226.59,109.56
Alba High Calcium Cocoa,cup,5.83,0.69,13.46,12.91,0.24,0.41,341.77,160.13
Alba High Calcium Cocoa,"packet dry mix, prepared with water",4.81,0.57,11.09,10.64,0.20,0.34,281.71,131.99
"Chocolate Milk, (Nestle's Quik), (Swiss Miss), with 1% fat milk",cup,10.08,2.70,21.55,17.40,1.00,1.74,372.50,222.50
"Chocolate beverage, (Jenny Craig), (Alba), from dry mix with milk and low calorie sweetener, water added",cup,7.12,0.75,14.63,9.38,2.76,0.53,408.47,198.71
"Milk, whole, with strawberry or vanilla flavor",cup,7.25,7.50,31.50,31.32,0.00,4.28,260.00,107.50
"Milk, reduced fat (2%), with strawberry or vanilla flavor",cup,7.62,4.58,30.20,28.50,1.00,2.81,410.00,122.50
"Milk, low fat (1%) with strawberry or vanilla flavor",cup,7.75,2.28,31.93,31.65,0.00,1.45,287.50,110.00
"Milk, fat free (skim), with strawberry or vanilla flavor",cup,7.75,0.23,31.80,31.35,0.00,0.13,280.00,105.00
"Malted milk, chocolate, with 2% milk",cup,8.04,5.01,26.70,23.41,0.94,2.94,267.90,131.60
"Malted milk, natural flavor, with 2% milk",cup,9.75,5.90,23.76,19.86,0.00,3.38,312.55,171.55
"Malted milk, natural flavor, with whole milk",cup,9.47,8.81,23.64,19.79,0.00,4.92,300.80,169.20
"Malted milk, fortified, natural flavor, with whole milk",cup,8.58,7.29,25.94,22.72,0.47,4.16,314.90,211.50
"Malted milk, fortified, natural flavor, with 2% milk",cup,8.88,4.54,25.94,22.75,0.47,2.85,329.00,220.90
"Malted milk, fortified, natural flavor, with skim milk",cup,9.05,0.42,26.25,22.77,0.47,0.25,333.70,209.15
"Malted milk, fortified, chocolate, with skim milk",cup,8.20,0.80,26.44,24.11,0.94,0.49,345.45,202.10
"Malted milk, fortified, chocolate, with whole milk",cup,7.73,7.66,26.13,24.06,0.94,4.40,326.65,204.45
"Malted milk, fortified, chocolate, with 2% milk",cup,8.06,4.91,26.13,24.09,0.94,3.09,343.10,211.50
"Malted milk, fortified, chocolate, with 1% milk",cup,8.20,2.73,26.56,24.39,0.94,1.73,352.50,206.80
"Eggnog, with whole milk",cup,11.56,10.64,20.45,20.45,0.00,6.58,330.20,137.16
"Eggnog, with 2% milk ",cup,12.04,8.05,16.54,16.81,0.00,3.89,269.24,154.94
"Milk shake,  fountain-type, chocolate, with whole milk",milkshake (10 fl oz),8.89,14.01,60.68,51.39,2.26,8.35,268.85,161.31
"Milk shake,  fountain-type, chocolate, with 2% milk",milkshake (10 fl oz),9.14,12.00,60.68,51.39,2.26,7.38,280.17,166.97
"Milk shake,  fountain-type, chocolate, with low fat milk",milkshake (10 fl oz),9.25,10.39,60.96,51.62,2.26,6.39,288.66,161.31
"Milk shake,  fountain-type, vanilla or strawberry, with whole milk",milkshake (10 fl oz),7.58,13.27,60.70,38.35,0.85,7.94,274.51,138.67
"Milk shake,  fountain-type, vanilla or strawberry, with 2% milk",milkshake (10 fl oz),7.92,9.73,61.01,38.60,0.85,6.03,291.49,138.67
"Milk shake,  fountain-type, vanilla or strawberry, with low fat milk",milkshake (10 fl oz),7.81,11.29,60.70,38.37,0.85,7.00,283.00,144.33
"Milk shake,  fountain-type, vanilla or strawberry, with skim milk",milkshake (10 fl oz),7.92,8.35,60.85,38.37,0.85,5.13,288.66,135.84
"Milk shake, with malt, with whole milk",milkshake (10 fl oz),9.65,14.35,61.50,56.06,0.57,8.45,311.30,192.44
"Milk shake, with malt, with 1% milk",milkshake (10 fl oz),9.99,10.95,61.78,56.29,0.57,6.62,331.11,192.44
"Milk shake, fast food or carry-out, chocolate",medium shake (20 fl oz),16.15,17.58,97.38,88.35,9.02,10.99,536.75,460.75
"Milk shake, fast food or carry-out, chocolate",Roy Rogers shake,11.32,12.32,68.27,61.94,6.33,7.70,376.29,323.01
"Milk shake, fast food or carry-out, chocolate",medium Burger King shake,13.50,14.69,81.39,73.84,7.54,9.18,448.61,385.09
"Milk shake, fast food or carry-out, chocolate",medium Dairy Queen shake,18.33,19.94,110.49,100.25,10.24,12.47,609.06,522.82
"Milk shake, fast food or carry-out, chocolate",McDonald's child size shake (12 fl oz),9.59,10.43,57.81,52.45,5.36,6.52,318.65,273.53
"Milk shake, fast food or carry-out, chocolate",McDonald's medium shake (21 fl oz),16.80,18.28,101.27,91.88,9.39,11.43,558.22,479.18
"Milk shake, fast food or carry-out, chocolate",cup,6.39,6.96,38.54,34.97,3.57,4.35,212.43,182.35
"Milk shake, fast food or carry out, vanilla or strawberry",medium shake (20 fl oz),16.01,30.97,93.05,64.74,4.28,18.82,546.25,384.75
"Milk shake, fast food or carry out, vanilla or strawberry",Roy Rogers shake,11.22,21.71,65.23,45.39,3.00,13.19,382.95,269.73
"Milk shake, fast food or carry out, vanilla or strawberry",medium Burger King shake,13.38,25.88,77.77,54.11,3.57,15.73,456.55,321.57
"Milk shake, fast food or carry out, vanilla or strawberry",medium Dairy Queen shake,18.16,35.14,105.59,73.46,4.85,21.35,619.84,436.58
"Milk shake, fast food or carry out, vanilla or strawberry",McDonald's child size shake (12 fl oz),9.50,18.39,55.24,38.44,2.54,11.17,324.29,228.41
"Milk shake, fast food or carry out, vanilla or strawberry",McDonald's medium shake (21 fl oz),16.65,32.21,96.77,67.33,4.45,19.57,568.10,400.14
"Fruit smoothie, made with whole milk",cup,4.76,4.51,27.34,22.91,1.46,2.51,156.74,58.52
"Fruit smoothie, made with fat free (skim) milk",cup,5.06,0.31,27.50,22.93,1.46,0.12,167.19,56.43
"Fruit smoothie, made with reduced fat (2%) milk",cup,4.95,2.82,27.34,22.93,1.46,1.71,165.10,62.70
"Fruit smoothie, made with low fat (1%) milk",cup,5.06,1.48,27.59,23.09,1.46,0.88,171.37,58.52
Orange Julius,cup,14.12,0.37,38.83,35.24,0.26,0.19,471.60,199.12
"Fruit smoothie, made with yogurt and ice cream",cup,3.45,3.41,41.21,33.75,2.42,2.03,107.06,54.54
"Fruit smoothie, made with yogurt and ice cream",commercial smoothie (20 fl oz),8.65,8.55,103.22,84.55,6.07,5.07,268.17,136.62
Chocolate-flavored drink,cup (drink box),1.56,0.98,26.06,21.18,1.46,0.76,243.99,222.03
Chocolate-flavored drink,bottle (9 fl oz),1.75,1.10,29.26,23.78,1.64,0.85,274.00,249.34
Strawberry-flavored drink,cup,1.56,0.98,26.06,21.18,1.46,0.76,243.99,222.03
Strawberry-flavored drink,bottle (9 fl oz),1.75,1.10,29.26,23.78,1.64,0.85,274.00,249.34
"Cafe con leche, with whole milk",coffee cup (6 fl oz),3.15,3.15,4.64,4.86,0.00,1.80,110.19,43.70
Cafe con leche  with sugar,coffee cup (6 fl oz),2.94,2.94,16.64,16.85,0.00,1.68,104.49,39.90
Cafe con leche with sugar and 2% milk,coffee cup (6 fl oz),3.08,1.80,16.64,16.85,0.00,1.13,110.19,43.70
"Instant breakfast, canned",cup,13.65,4.70,32.33,32.85,0.25,2.73,352.50,222.50
"Instant breakfast, canned",can (10 fl oz),17.09,5.88,40.47,41.13,0.31,3.41,441.32,278.56
"Instant breakfast, powder, with 2% milk",cup,13.55,4.70,31.83,32.25,0.13,2.88,350.06,226.02
"Instant breakfast, powder, with whole milk ",cup,13.23,7.42,31.83,32.68,0.13,4.18,335.05,217.44
"Instant breakfast, powder, with skim milk",cup,13.68,0.62,32.10,32.25,0.13,0.30,354.17,214.90
"Instant breakfast, powder, with 1% milk",cup,13.70,2.54,32.23,32.55,0.13,1.54,360.79,219.58
"Instant breakfast, powder, low calorie sweetener, with 2% milk",cup,14.23,5.47,18.63,18.85,0.38,3.28,367.51,241.46
"Diet beverage, powder, made with fat free milk",cup,14.38,1.14,18.97,18.90,0.49,0.53,372.97,229.71
Ensure Nutrition Shake,cup,8.68,3.47,27.03,27.03,0.00,0.63,198.40,421.60
Ensure Nutrition Shake,can (11 fl oz),11.94,4.77,37.17,37.17,0.00,0.87,272.80,579.70
Ensure Nutrition Shake,carton (12 fl oz),13.02,5.21,40.55,40.55,0.00,0.95,297.60,632.40
"Meal supplement, high calorie, canned or powdered, reconstituted",cup,10.53,6.57,32.35,32.28,0.00,0.89,230.00,165.00
"Meal supplement, high calorie, canned or powdered, reconstituted",can  (12.5 fl oz),16.80,10.49,51.63,51.51,0.00,1.42,367.08,263.34
"Meal replacement, high protein, liquid",cup,14.59,5.63,33.28,33.28,0.00,0.92,240.64,220.16
Boost Nutritional Energy Drink,cup,14.59,5.63,33.28,33.28,0.00,0.92,240.64,220.16
"Milk, dry, whole, not reconstituted",cup,33.69,34.19,49.18,49.18,0.00,21.43,1167.36,474.88
"Milk, dry, whole, not reconstituted",tablespoon,2.11,2.14,3.07,3.07,0.00,1.34,72.96,29.68
Low fat dry milk powder,cup,41.71,2.04,62.00,62.00,0.00,1.29,1462.80,652.80
Low fat dry milk powder,tablespoon,2.61,0.13,3.88,3.88,0.00,0.08,91.43,40.80
"Milk, dry, nonfat, not reconstituted",cup,23.87,0.49,35.49,35.49,0.00,0.32,837.08,373.32
"Milk, dry, nonfat, not reconstituted",tablespoon,1.51,0.03,2.24,2.24,0.00,0.02,52.81,23.55
"Buttermilk, dry, not reconstituted",tablespoon,2.23,0.38,3.19,3.19,0.00,0.23,76.96,33.61
"Whey, sweet, dry",tablespoon,0.97,0.08,5.58,5.58,0.00,0.05,59.70,80.93
"Cocoa, dry mix (with milk & sugar), not reconstituted",tablespoon,0.53,0.32,6.70,5.24,0.30,0.19,10.64,40.32
"Cocoa, dry mix (with nonfat dry milk & low calorie sweetener), not reconstituted",tablespoon,1.08,0.21,5.04,2.64,0.53,0.12,40.32,61.32
"Cocoa powder, unsweetened",cup,16.86,11.78,49.79,1.51,28.55,6.94,110.08,18.06
"Cocoa powder, unsweetened",tablespoon,1.06,0.74,3.13,0.09,1.79,0.44,6.91,1.13
"Cocoa powder, unsweetened",teaspoon,0.35,0.25,1.04,0.03,0.60,0.15,2.30,0.38
"Chocolate flavored powdered drink mix, not reconstituted",tablespoon,0.43,0.29,9.96,9.11,0.51,0.23,27.06,16.61
"Chocolate-flavored powdered drink mix with low-calorie sweetener, not reconstituted",tablespoon,1.08,0.21,5.04,2.64,0.53,0.12,40.32,61.32
"Malted milk, dry mix, fortified, natural flavor, not reconstituted",serving (4 tablespoons),1.98,0.28,17.55,13.31,0.40,0.14,78.96,133.56
"Malted milk, dry mix, fortified, chocolate, not reconstituted",serving (4 tablespoons),1.03,0.71,17.77,14.82,0.99,0.41,93.03,124.74
"Nestle's Quik powder, strawberry",serving (2-3 heaping teaspoons),0.02,0.04,21.80,21.00,0.00,0.00,0.88,8.36
"Instant breakfast, powder, not reconstituted",tablespoon,1.47,0.10,4.90,4.87,0.03,0.04,21.09,28.49
"Instant breakfast, powder, sweetened with low calorie sweetener, not reconstituted",tablespoon,2.00,0.29,2.30,2.18,0.11,0.12,28.00,40.15
"Protein supplement powder, milk-based, not reconstituted",tablespoon,3.23,0.17,6.47,6.47,0.00,0.06,95.37,54.45
"Meal replacement powder, high protein, milk-based, to mix with fruit juice, not reconstituted",tablespoon,2.34,0.00,3.98,2.58,1.40,0.00,93.59,17.52
"Meal replacement powder, high protein, milk-based, to mix with fruit juice, not reconstituted",scoop (1.1 oz),9.92,0.00,16.90,10.94,5.95,0.00,397.42,74.40
"Meal replacement powder, milk-based, not reconstituted",tablespoon,2.64,0.06,9.53,9.23,0.30,0.03,79.35,54.90
"Meal replacement powder, milk-based, not reconstituted",scoop (1.2 oz),5.81,0.13,20.96,20.30,0.66,0.06,174.57,120.78
"Nutrient supplement powder, milk-based, not reconstituted",tablespoon,2.94,0.44,8.30,8.30,0.00,0.27,88.13,33.00
"Nutrient supplement powder, milk-based, high protein, not reconstituted",packet (0.95 oz),15.01,2.00,5.00,4.73,0.27,0.19,200.07,103.95
"Meal replacement powder, milk- and soy-based,  not reconstituted",tablespoon,3.37,0.22,4.72,4.52,0.20,0.03,112.40,83.10
"Meal replacement powder, milk- and soy-based,  not reconstituted",packet (D.E.L.T.A),14.83,0.97,20.77,19.89,0.88,0.14,494.56,365.64
"Cream, light",cup,6.48,46.34,8.78,8.78,0.00,28.85,230.39,96.00
"Cream, light",tablespoon,0.41,2.90,0.55,0.55,0.00,1.80,14.40,6.00
"Cream, light, whipped, unsweetened",cup,2.60,37.09,3.55,3.55,0.00,23.20,82.80,40.80
"Cream, light, whipped, unsweetened",tablespoon,0.16,2.32,0.22,0.22,0.00,1.45,5.18,2.55
"Cream, half and half",cup,7.16,27.83,10.41,10.41,0.00,17.32,254.09,99.22
"Cream, half and half",tablespoon,0.45,1.74,0.65,0.65,0.00,1.08,15.86,6.19
"Cream, half and half, low fat",cup,6.73,15.61,16.09,11.25,0.00,9.68,241.99,169.39
"Cream, half and half, low fat",tablespoon,0.42,0.97,1.00,0.70,0.00,0.60,15.10,10.57
"Cream, half and half, fat free",cup,6.29,3.39,21.78,12.10,0.00,2.04,232.31,241.99
"Cream, half and half, fat free",tablespoon,0.39,0.21,1.36,0.76,0.00,0.13,14.50,15.10
"Cream, heavy (whipping cream)",cup,4.88,88.06,6.64,6.64,0.00,54.81,154.69,90.44
"Cream, heavy (whipping cream)",tablespoon,0.31,5.51,0.42,0.42,0.00,3.43,9.69,5.66
"Cream, heavy, whipped, unsweetened",cup,2.44,44.03,3.32,3.32,0.00,27.41,77.34,45.22
"Cream, heavy, whipped, unsweetened",tablespoon,0.15,2.74,0.21,0.21,0.00,1.70,4.81,2.81
"Cream, heavy, whipped, sweetened",cup,2.30,41.42,10.16,10.02,0.00,25.78,72.58,42.84
"Cream, heavy, whipped, sweetened",tablespoon,0.14,2.58,0.63,0.62,0.00,1.60,4.51,2.66
"Cream, whipped, pressurized container",cup,1.92,13.33,7.49,4.80,0.00,8.30,60.60,4.80
"Cream, whipped, pressurized container",tablespoon,0.12,0.84,0.47,0.30,0.00,0.53,3.84,0.30
"Cream, whipped, pressurized container, light",cup,2.05,14.22,7.99,5.12,0.00,8.85,64.64,5.12
"Cream, whipped, pressurized container, light",tablespoon,0.13,0.89,0.50,0.32,0.00,0.55,4.04,0.32
"Cream, whipped, pressurized container, fat free",cup,1.92,3.20,16.00,10.24,0.26,1.84,69.12,46.08
"Cream, whipped, pressurized container, fat free",tablespoon,0.12,0.20,1.00,0.64,0.02,0.11,4.32,2.88
"Coffee creamer, liquid",cup,2.40,23.93,27.31,27.31,0.00,4.65,21.60,160.79
"Coffee creamer, liquid",tablespoon,0.15,1.50,1.71,1.71,0.00,0.29,1.35,10.05
"Coffee creamer, flavored, liquid",cup,1.66,32.40,84.16,79.29,2.64,6.32,14.40,160.79
"Coffee creamer, flavored, liquid",tablespoon,0.10,2.03,5.26,4.96,0.17,0.40,0.90,10.05
"Coffee creamer, light, liquid",cup,1.94,8.47,22.02,22.02,0.00,2.17,2.42,145.19
"Coffee creamer, light, liquid",tablespoon,0.12,0.53,1.37,1.37,0.00,0.14,0.15,9.06
"Coffee creamer, powdered",packet,0.14,1.06,1.65,1.65,0.00,0.98,0.66,3.69
"Coffee creamer, powdered",teaspoon,0.10,0.71,1.10,1.10,0.00,0.65,0.44,2.46
"Coffee creamer, light, powdered",packet,0.06,0.47,2.20,2.20,0.00,0.11,0.03,6.87
"Coffee creamer, light, powdered",teaspoon,0.04,0.31,1.47,1.47,0.00,0.08,0.02,4.58
"Coffee creamer, flavored, powdered",packet,0.02,0.64,2.26,1.74,0.04,0.58,0.15,3.69
"Coffee creamer, flavored, powdered",teaspoon,0.01,0.43,1.51,1.16,0.02,0.39,0.10,2.46
Cool Whip pressurized can,tablespoon,0.04,0.98,0.71,0.71,0.00,0.83,0.22,2.73
Cool Whip frozen,tablespoon,0.06,1.19,1.08,1.08,0.00,1.02,0.28,1.18
Cool Whip Lite frozen,tablespoon,0.14,0.62,1.11,1.11,0.00,0.53,3.34,3.38
Cool Whip Free frozen,tablespoon,0.14,0.24,1.18,0.75,0.02,0.13,5.08,3.38
Cool Whip Sugar Free frozen ,tablespoon,0.14,0.62,1.11,1.11,0.00,0.53,3.34,3.38
Dream Whip ,tablespoon,0.18,0.64,0.86,0.86,0.00,0.53,4.50,3.30
Sour cream,tablespoon,0.30,2.84,0.41,0.41,0.00,1.66,15.84,6.77
"Sour cream, half and half",tablespoon,0.44,1.80,0.64,0.02,0.00,1.12,15.60,13.35
"Sour cream, half and half",ounce(s),0.83,3.39,1.20,0.05,0.00,2.11,29.38,25.14
"Sour cream, half and half",container (8 oz),6.64,27.12,9.63,0.36,0.00,16.88,235.03,201.13
"Sour cream, reduced fat",tablespoon,1.12,2.26,1.12,0.05,0.00,1.39,22.56,11.20
"Sour cream, reduced fat",ounce(s),1.98,3.98,1.98,0.08,0.00,2.46,39.83,19.78
"Sour cream, reduced fat",container (8 oz),15.82,31.86,15.82,0.68,0.00,19.66,318.65,158.19
"Sour cream, light",tablespoon,0.56,1.70,1.14,0.04,0.00,1.06,22.56,13.28
"Sour cream, light",teaspoon,0.19,0.56,0.38,0.01,0.00,0.35,7.52,4.42
"Sour cream, light",ounce(s),0.99,2.99,2.01,0.06,0.00,1.86,39.83,23.45
"Sour cream, light",container (8 oz),7.91,23.95,16.04,0.50,0.00,14.91,318.65,187.57
Nonfat sour cream ,tablespoon,0.50,0.00,2.50,0.06,0.00,0.00,20.00,22.56
Nonfat sour cream ,ounce(s),0.88,0.00,4.41,0.11,0.00,0.00,35.31,39.83
Nonfat sour cream ,container (8 oz),7.01,0.00,35.25,0.88,0.00,0.00,282.49,318.65
"Sour cream, imitation (nondairy)",tablespoon,0.35,2.81,0.95,0.95,0.00,2.56,0.43,14.69
"Sour cream, imitation (nondairy)",ounce(s),0.68,5.53,1.88,1.88,0.00,5.04,0.85,28.92
"Sour cream, imitation (nondairy)",container (8 oz),5.45,44.31,15.05,15.05,0.00,40.39,6.81,231.54
"Dip, made with sour cream",tablespoon,0.28,4.81,0.41,0.35,0.03,1.68,13.07,64.60
"Dip, made with fat free sour cream",tablespoon,0.52,0.00,2.90,0.11,0.07,0.00,19.19,106.32
"Dip, made with light sour cream",tablespoon,0.58,1.50,1.72,0.08,0.07,0.93,21.45,98.99
"Dip, made with reduced fat sour cream",tablespoon,0.38,3.83,0.56,0.05,0.03,1.21,12.30,66.30
"Spinach dip, made with sour cream and mayonnaise",tablespoon,0.33,3.64,0.78,0.27,0.21,0.90,11.25,43.80
"Spinach dip, made with fat free sour cream and low-calorie mayonnaise",tablespoon,0.37,0.81,2.16,0.31,0.20,0.13,12.07,49.44
"Spinach dip, made with reduced fat sour cream and mayonnaise",tablespoon,0.53,3.56,1.03,0.19,0.20,0.81,12.54,41.60
"Ice cream, regular, vanilla or other flavors",cup,4.66,14.63,31.39,28.22,0.93,9.03,170.24,106.40
"Ice cream, regular, vanilla or other flavors",medium scoop,2.31,7.26,15.58,14.01,0.46,4.48,84.48,52.80
"Ice cream, regular, vanilla or other flavors",single-serve cup (3 fl oz),1.79,5.61,12.04,10.82,0.36,3.46,65.28,40.80
"Ice cream, regular, chocolate",cup,5.05,14.63,37.51,33.73,1.60,9.04,144.97,101.08
"Ice cream, regular, chocolate",single-serve cup (3.5 fl oz),2.28,6.60,16.92,15.22,0.72,4.08,65.40,45.60
"Ice cream, regular, chocolate",medium scoop,2.51,7.26,18.61,16.74,0.79,4.49,71.94,50.16
"Ben and Jerry's ice cream, vanilla or other flavors",cup,5.18,23.98,32.99,30.56,0.00,15.29,173.16,90.28
"Ben and Jerry's ice cream, vanilla or other flavors",medium scoop,2.59,11.99,16.49,15.28,0.00,7.64,86.58,45.14
"Ben and Jerry's ice cream, vanilla or other flavors",Viennetta slice,2.35,10.85,14.93,13.84,0.00,6.92,78.39,40.87
"Ben and Jerry's ice cream, chocolate",cup,6.99,25.13,30.71,25.68,1.33,15.36,210.16,84.36
"Ben and Jerry's ice cream, chocolate",medium scoop,3.49,12.57,15.36,12.84,0.67,7.68,105.08,42.18
"Ben and Jerry's ice cream, chocolate",Viennetta slice,3.16,11.38,13.90,11.62,0.60,6.95,95.14,38.19
"Ice cream, soft serve, vanilla or other flavors",cup,6.06,19.03,40.83,36.71,1.21,11.75,221.44,138.40
"Ice cream, soft serve, chocolate",cup,7.09,22.49,38.41,36.61,1.21,12.91,226.63,105.53
