foodname,portiondesc,Protein,Total Fat,Carbohydrate,Total Sugar,Dietary Fiber,Saturated Fat,Calcium,Sodium
"Croissant sandwich, with ham, egg, and cheese",Burger King sandwich,18.49,24.59,26.97,7.60,1.73,11.87,275.02,855.30
"Croissant sandwich, with ham, egg, and cheese",sandwich,18.49,24.59,26.97,7.60,1.73,11.87,275.02,855.30
"Croissant sandwich, with ham, egg, and cheese",Dunkin' Donuts sandwich,23.11,30.74,33.71,9.50,2.16,14.83,343.80,1069.20
"Croissant sandwich, with sausage, egg, and cheese",Burger King sandwich,19.22,34.63,25.28,4.96,2.86,13.26,143.10,917.43
"Croissant sandwich, with sausage, egg, and cheese",sandwich,19.22,34.63,25.28,4.96,2.86,13.26,143.10,917.43
"Croissant sandwich, with sausage, egg, and cheese",Dunkin' Donuts sandwich,21.76,39.20,28.62,5.62,3.24,15.02,162.00,1038.60
"Croissant sandwich, with bacon, egg, and cheese",Burger King sandwich,16.55,24.46,24.13,7.03,1.18,11.56,248.96,679.62
"Croissant sandwich, with bacon, egg, and cheese",sandwich,16.55,24.46,24.13,7.03,1.18,11.56,248.96,679.62
"Croissant sandwich, with bacon, egg, and cheese",Arby's sandwich,18.38,27.16,26.79,7.81,1.31,12.84,276.41,754.56
"Croissant sandwich, with bacon, egg, and cheese",Dunkin' Donuts sandwich,25.25,37.31,36.81,10.73,1.80,17.64,379.80,1036.80
Vegetable submarine sandwich (Veggie Sub),sub sandwich,6.55,3.14,38.52,8.47,2.84,0.67,125.24,661.28
Vegetable submarine sandwich (Veggie Sub),"Subway Sub (6"" long)",6.55,3.14,38.52,8.47,2.84,0.67,125.24,661.28
Biscuit with sausage gravy,Hardee's biscuit,11.85,25.64,45.61,8.80,0.88,6.96,179.01,1093.95
Biscuit with sausage gravy,biscuit with gravy,11.85,25.64,45.61,8.80,0.88,6.96,179.01,1093.95
Chicken cornbread,"piece (2-1/2"" x 2-1/2"" x 1-1/2"")",9.48,4.79,6.26,0.18,0.27,1.08,9.38,236.51
Dressing (stuffing) with oysters,cup,7.84,17.28,29.46,4.14,2.25,3.42,180.32,829.15
Dressing (stuffing) with chicken or turkey and vegetables,cup,13.04,17.85,33.60,4.27,2.58,4.02,189.98,843.64
Dressing (stuffing) with meat (sausage) and vegetables ,cup,11.01,27.05,32.81,4.14,2.25,7.89,177.10,1107.68
"Lasagna, with beef","piece (2-1/2"" x 4)",15.33,10.75,33.15,7.11,3.30,4.97,181.28,819.88
"Lasagna, with beef, canned (Chef Boyardee)",can (15 oz),14.49,14.49,58.35,10.20,6.80,6.06,55.25,1504.50
"Lasagna, with beef and spinach","piece (2-1/2"" x 4)",19.43,11.29,33.31,5.13,2.88,5.83,247.20,618.00
"Lasagna, with chicken or turkey","piece (2-1/2"" x 4)",20.89,11.08,35.45,5.48,2.68,5.57,247.20,655.08
"Lasagna, with chicken or turkey, and spinach","piece (2-1/2"" x 4)",20.13,9.27,33.27,5.13,2.88,4.82,245.14,547.96
"Lasagna, meatless","piece (2-1/2"" x 4)",14.85,12.10,31.42,9.60,3.86,4.79,251.97,644.68
"Lasagna, meatless, with vegetables (vegetarian lasagna)","piece (2-1/2"" x 4)",15.66,8.67,39.00,6.45,3.63,5.01,267.86,594.74
"Lasagna with meat, whole wheat noodles ","piece (2-1/2"" x 4)",19.55,11.80,31.64,5.71,3.71,6.25,257.50,659.20
"Lasagna, meatless, whole wheat noodles","piece (2-1/2"" x 4)",17.12,9.67,38.88,7.01,4.54,5.80,306.45,687.81
"Lasagna with meat, spinach noodles","piece (2-1/2"" x 4)",19.20,11.82,29.46,5.77,4.12,6.23,259.56,826.06
"Lasagna, meatless, spinach noodles ","piece (2-1/2"" x 4)",16.00,9.62,36.27,7.08,5.22,5.78,310.99,896.65
"Ravioli, meat filled, no sauce",ounce(s),3.57,2.02,4.91,0.07,0.17,0.75,9.62,219.61
"Ravioli, meat filled, no sauce",piece,1.89,1.07,2.60,0.04,0.09,0.40,5.10,116.40
"Ravioli, meat filled, with tomato sauce or meat sauce",piece,3.06,2.12,4.98,0.62,0.35,0.70,10.15,208.95
"Ravioli, meat filled, with tomato sauce or meat sauce, canned (Chef Boyardee)",piece,1.13,1.13,4.53,0.79,0.53,0.47,4.29,116.82
"Ravioli, meat filled, with tomato sauce or meat sauce, canned (Chef Boyardee)",can (15 oz),14.49,14.49,58.35,10.20,6.80,6.06,55.25,1504.50
"Ravioli, meat filled, with cream sauce",piece,3.55,3.00,4.70,0.58,0.14,0.99,20.65,203.70
"Ravioli, cheese filled, no sauce",ounce(s),2.40,1.88,5.72,0.07,0.20,1.01,26.89,180.84
"Ravioli, cheese filled, no sauce",piece,1.27,1.00,3.03,0.04,0.11,0.54,14.25,95.85
"Ravioli, cheese filled, with tomato sauce",piece,1.51,0.87,5.78,1.37,0.46,0.40,26.22,93.48
"Ravioli, cheese filled, with tomato sauce, canned (Chef Boyardee)",piece,0.62,0.36,3.41,0.93,0.33,0.18,8.25,76.50
"Ravioli, cheese filled, with tomato sauce, canned (Chef Boyardee)",can (15 oz),10.54,6.16,57.97,15.81,5.53,3.07,140.25,1300.50
"Ravioli, cheese filled, with meat sauce",piece,2.46,2.21,4.71,0.55,0.28,0.96,21.35,212.80
"Ravioli, cheese filled, with cream sauce",piece,2.57,3.09,5.77,0.69,0.19,1.28,39.14,179.36
"Ravioli, cheese and spinach filled, no sauce",ounce(s),2.00,1.28,5.67,0.08,0.31,0.62,23.77,145.46
"Ravioli, cheese and spinach filled, no sauce",piece,1.06,0.68,3.01,0.04,0.17,0.33,12.60,77.10
"Ravioli, cheese and spinach filled, with cream sauce",piece,2.22,2.53,5.76,0.69,0.27,0.92,36.10,148.20
"Ravioli, cheese and spinach filled, with tomato sauce",piece,2.11,1.27,6.19,0.60,0.49,0.61,24.70,205.58
"Spaghetti with tomato sauce, meatless",cup,8.93,6.99,47.59,7.19,4.46,0.95,39.68,627.44
"Pasta with tomato sauce and cheese, canned (SpaghettiOs)",cup,5.53,1.10,35.41,9.96,2.24,0.34,32.37,677.28
"Spaghetti and meatballs, tomato sauce, white noodles, oil added",cup,14.38,10.89,42.83,6.50,3.97,2.59,42.16,662.16
"Spaghetti and meatballs, canned (Spaghetti-Os)",cup,11.11,9.96,27.12,6.60,6.72,3.58,89.64,784.35
"Spaghetti, tomato sauce, white noodles, oil added",cup,9.08,6.75,48.01,6.35,4.22,0.93,37.20,498.48
"Spaghetti, tomato sauce, whole wheat noodles, oil added",cup,8.36,6.50,42.18,7.51,7.69,0.86,49.60,629.92
"Spaghetti and meatballs, tomato sauce, whole wheat noodles, oil added",cup,13.84,10.44,37.97,6.75,6.94,2.50,52.08,664.64
"Spaghetti, tomato sauce, spinach noodles, oil added",cup,7.32,6.10,40.55,7.24,6.45,0.78,57.04,845.68
"Spaghetti and meatballs, tomato sauce, spinach noodles, oil added",cup,12.57,9.85,36.75,6.55,5.95,2.33,57.04,858.08
"Spaghetti, tomato sauce, with hotdogs, oil added",cup,12.28,17.46,40.23,5.98,3.72,5.33,39.68,865.52
"Spaghetti and hotdogs, canned (Spaghetti-Os)",cup,11.06,6.02,32.13,8.02,4.05,2.51,151.79,726.08
"Spaghetti, red clam sauce",cup,22.07,20.31,41.54,2.26,2.48,2.89,59.52,389.36
"Spaghetti, white clam sauce",cup,17.24,24.50,43.33,0.74,2.48,3.45,44.64,662.16
"Spaghetti, tomato sauce, with chicken, oil added",cup,15.18,8.08,42.56,6.45,3.97,1.31,39.68,622.48
"Manicotti, cheese filled, no sauce",manicotti,15.47,12.73,22.82,0.70,0.76,7.11,261.62,529.59
"Manicotti, cheese filled, with tomato sauce, meatless",cup,20.94,16.59,34.03,4.35,2.12,9.23,352.50,1012.85
"Manicotti, cheese filled, with tomato sauce, meatless",manicotti,12.74,10.09,20.70,2.65,1.29,5.61,214.49,616.29
"Manicotti, cheese filled, with meat sauce",manicotti,14.34,11.00,19.33,2.47,1.14,5.84,201.62,612.00
"Manicotti, vegetable  and cheese filled, with tomato sauce, meatless",manicotti,10.77,7.86,20.88,2.65,1.57,4.22,171.59,559.09
"Stuffed shells, cheese filled, no sauce",cup,17.33,13.86,30.49,0.85,1.06,7.53,266.00,621.68
"Stuffed shells, cheese  and spinach  filled, no sauce",cup,15.90,10.37,31.77,0.53,1.67,5.56,253.84,623.20
"Tortellini, meat filled, with tomato sauce",cup,14.09,10.33,32.80,3.00,2.10,3.04,92.40,1297.80
"Tortellini, meat filled, with tomato sauce, canned",cup,8.34,4.40,35.53,4.57,2.33,1.44,62.91,733.95
"Tortellini, cheese filled, meatless, with tomato sauce",cup,15.45,9.12,56.90,7.40,4.00,3.88,180.00,697.50
"Tortellini, cheese filled, meatless, with tomato sauce, canned",cup,8.69,3.66,39.12,4.25,1.73,1.39,71.63,743.47
"Tortellini, cheese filled, meatless, with vegetables and vinaigrette dressing (Stouffer's Cheese Tortellini Vinaigrette )",cup,12.22,25.52,24.52,2.04,2.87,6.27,241.67,444.47
"Tortellini, cheese filled, meatless, with vegetables and vinaigrette dressing (Stouffer's Cheese Tortellini Vinaigrette )",Stouffer's meal (6.875 oz),14.10,29.45,28.29,2.36,3.32,7.23,278.85,512.85
"Tortellini, cheese filled, meatless, with vinaigrette dressing",cup,12.08,18.25,29.52,1.00,1.01,6.68,136.89,1069.77
"Tortellini, meat filled, no sauce",cup,23.79,14.21,32.92,0.47,1.14,5.09,150.09,788.46
"Tortellini, cheese filled, with cream sauce",cup,16.15,18.50,38.85,3.98,1.25,7.75,240.00,1442.50
"Tortellini, cheese filled, no sauce",cup,15.57,8.34,54.22,1.10,2.25,4.15,166.50,234.00
"Tortellini, spinach filled, with tomato sauce",cup,9.42,8.62,31.90,2.92,2.40,2.47,110.00,1192.00
"Tortellini, spinach filled, no sauce",cup,11.41,8.76,25.16,0.40,1.10,3.14,124.44,225.70
"Cannelloni, cheese  and spinach filled, no sauce",cup,14.85,13.98,35.84,1.58,2.50,6.09,230.88,1245.92
"Chow fun noodles, with pork and vegetables",cup,10.78,4.16,17.50,1.67,1.37,1.29,24.32,246.24
"Chow fun noodles, with vegetables, meatless",cup,2.37,1.47,21.98,2.11,1.67,0.25,22.80,287.28
"Lo mein, meatless",cup,9.54,4.70,40.32,5.26,2.60,0.93,42.00,860.00
"Lo mein, with shrimp",cup,17.12,4.42,32.48,4.16,2.00,0.95,72.00,1078.00
"Lo mein, with pork",cup,18.96,7.58,32.36,4.22,2.00,2.13,40.00,714.00
"Lo mein, with beef",cup,19.46,5.54,32.36,4.22,2.00,1.40,40.00,716.00
"Lo mein, with chicken",cup,19.38,5.44,32.30,4.22,2.00,1.12,36.00,730.00
"Pad Thai, meatless",cup,11.10,18.16,33.02,9.50,3.40,2.75,128.00,692.00
"Pad Thai, with chicken",cup,17.18,14.00,28.66,8.32,2.40,2.26,38.00,682.00
"Pad Thai, with seafood",cup,13.58,13.40,30.04,8.58,2.40,2.14,64.00,952.00
"Pad Thai, with beef",cup,16.28,15.62,29.40,8.54,2.40,3.04,40.00,676.00
"Macaroni and cheese, made with margarine",cup,21.63,24.52,55.62,6.12,2.92,13.10,413.10,869.94
"Macaroni and cheese, made with butter",cup,18.77,22.20,53.73,8.43,2.67,12.99,351.10,908.57
"Macaroni and cheese, made without fat",cup,19.42,14.51,55.82,8.75,2.77,8.08,362.28,883.32
"Macaroni and cheese, made with vegetable oil ",cup,18.71,23.75,53.80,8.43,2.67,9.07,349.19,851.42
"Macaroni and cheese, canned",cup,8.08,5.88,27.53,1.20,1.20,2.11,83.65,721.78
"Macaroni and cheese, with tuna (Tuna Helper)",cup,18.54,17.50,44.32,6.85,1.94,4.16,119.07,468.99
"Macaroni and cheese, with beef (Hamburger Helper)",cup,27.07,18.30,21.68,0.58,1.22,8.93,187.11,2050.92
"Macaroni and cheese, with tomato",cup,9.45,16.84,45.56,8.09,2.67,4.00,114.21,347.49
"Macaroni and cheese, with pork or ham",cup,25.25,22.06,38.98,7.02,1.70,9.19,303.75,1479.87
"Macaroni and cheese, with hotdogs",cup,14.94,31.25,45.85,7.51,1.94,9.53,116.64,843.21
"Macaroni and cheese, made with egg and margarine",cup,14.94,24.76,46.17,7.27,1.94,5.96,138.51,551.61
"Macaroni and cheese, made with egg and butter",cup,19.43,23.28,50.60,8.54,2.47,13.42,359.72,933.33
"Macaroni and cheese, made with egg, without fat",cup,20.11,15.53,52.60,8.87,2.57,8.46,371.40,908.71
"Macaroni and cheese, made with egg and vegetable oil ",cup,19.37,24.85,50.67,8.55,2.48,9.45,357.81,875.44
"Macaroni and cheese, with chicken",cup,32.68,17.47,36.06,5.59,1.70,4.11,94.77,371.79
"Pasta with tomato sauce, meatless",cup,8.93,6.99,47.59,7.19,4.46,0.95,39.68,627.44
Pasta with meat sauce,cup,15.91,11.35,50.41,5.28,4.08,2.59,38.25,591.58
Pasta with cheese and meat sauce (Cannelloni) ,cup,19.92,17.42,30.37,3.56,1.94,7.11,142.77,810.67
Pasta with cheese and meat sauce (Cannelloni) ,cannelloni,7.08,6.19,10.79,1.26,0.69,2.53,50.74,288.10
Pasta with carbonara sauce,cup,19.40,18.01,49.08,1.91,3.01,9.16,166.82,534.63
"Pasta with cheese and tomato sauce, meatless",cup,10.41,9.22,44.96,6.82,4.11,2.58,96.80,735.65
"Pasta with vegetables, no sauce or dressing",cup,11.01,8.63,57.59,3.08,5.95,1.23,34.72,369.52
"Pasta, meat-filled, with gravy, canned (Chef Boyardee Mini Chicken Ravioli)",cup,11.95,7.72,51.10,1.73,2.00,2.49,42.50,1082.50
"Pasta, whole wheat, with meat sauce",cup,15.25,10.79,44.22,5.61,7.90,2.48,48.45,594.13
"Pasta, whole wheat, with tomato sauce, meatless",cup,8.36,6.50,42.18,7.51,7.69,0.86,49.60,629.92
Pasta with pesto sauce,cup,8.88,23.56,27.33,0.81,1.83,3.98,103.70,374.54
Macaroni or noodles with beans or lentils and tomato sauce,cup,11.87,4.90,47.10,5.06,6.81,0.70,81.72,424.49
"Macaroni, creamed, made with margarine",cup,9.74,11.00,41.20,4.72,2.00,2.87,118.00,458.00
"Macaroni, creamed, made with butter",cup,9.13,10.69,38.60,4.97,1.91,6.29,111.73,503.52
"Macaroni, creamed, made with sour cream",cup,9.25,4.61,38.85,5.32,1.91,2.34,120.35,454.03
"Macaroni, creamed,without fat",cup,9.52,2.77,40.61,5.23,2.01,1.24,115.07,469.61
"Macaroni, creamed, made with vegetable oil ",cup,9.07,12.20,38.67,4.98,1.92,2.44,109.58,447.18
"Macaroni, creamed, with cheese, made with margarine (Fettucine Alfredo)",cup,13.14,29.86,45.20,1.84,2.60,18.20,170.00,420.00
"Macaroni, creamed, with cheese, made with butter (Fettucine Alfredo)",cup,16.32,17.35,48.04,1.04,2.72,10.17,234.06,328.34
"Macaroni, creamed, with cheese, made with vegetable oil (Fettucine Alfredo)",cup,16.28,18.52,48.11,1.04,2.73,7.23,232.60,284.93
"Macaroni, creamed, with cheese, made without fat (Fettucine Alfredo)",cup,16.89,11.62,49.94,1.08,2.83,6.51,241.43,295.74
"Macaroni, creamed, with vegetables",cup,9.06,9.62,37.62,4.98,2.60,2.51,114.00,404.00
"Macaroni, creamed, with vegetables, made without fat",cup,8.23,8.02,33.53,5.08,2.56,2.08,104.43,246.14
"Pasta, beef or chicken flavored, made with margarine (Lipton)",cup,4.55,4.13,26.71,1.83,0.74,0.82,11.10,321.90
"Pasta, beef or chicken flavored, made with butter (Lipton)",cup,6.92,8.65,26.51,0.70,1.22,4.83,23.35,510.54
"Pasta, beef or chicken flavored, made without fat (Lipton)",cup,4.66,0.67,27.32,1.87,0.74,0.17,11.10,296.00
"Pasta, beef or chicken flavored, made with vegetable oil (Lipton)",cup,6.86,9.90,26.55,0.70,1.23,1.63,21.41,463.84
"Pasta salad (macaroni salad), made with mayonnaise  ",cup,7.89,20.39,43.61,3.29,2.48,3.23,14.16,361.08
"Pasta salad (macaroni salad), with egg, made with mayonnaise  ",cup,9.19,20.25,39.88,3.19,2.30,3.46,21.24,346.92
"Pasta salad (macaroni salad), with egg, made with light mayonnaise",cup,9.01,9.29,35.20,6.70,1.98,2.07,30.83,783.50
"Pasta salad (macaroni salad), with egg, made with low calorie dressing (Miracle Whip Light)",cup,9.26,8.97,37.23,6.24,2.01,1.94,34.63,830.54
"Pasta salad (macaroni salad), with egg, made with mayonnaise-type dressing (Miracle Whip)",cup,9.24,12.63,37.24,6.76,2.00,2.44,34.62,836.27
"Pasta salad (macaroni salad), with tuna, made with mayonnaise ",cup,11.97,17.52,36.92,2.80,2.12,2.79,15.93,371.70
"Pasta salad (macaroni salad), with tuna, made with light mayonnaise",cup,12.19,5.27,36.67,6.45,2.15,0.95,19.16,861.53
"Pasta salad (macaroni salad), with tuna, with low calorie dressing (Miracle Whip Light)",cup,12.42,4.98,38.33,6.08,2.17,0.83,22.15,900.43
"Pasta salad (macaroni salad), with tuna, made with mayonnaise-type dressing (Miracle Whip)",cup,12.40,7.95,38.34,6.50,2.17,1.24,22.16,904.98
"Pasta salad (macaroni salad), with crab",cup,11.47,17.52,37.05,2.80,2.12,2.80,37.17,410.64
"Pasta salad (macaroni salad), with shrimp",cup,11.97,17.81,37.35,2.83,2.12,2.81,49.56,529.23
"Pasta salad (macaroni salad), with tuna and egg",cup,12.76,17.63,34.23,2.73,1.95,3.02,23.01,361.08
"Pasta salad (macaroni salad), with chicken",cup,14.58,18.46,37.05,2.80,2.12,2.99,14.16,332.76
"Pasta salad (macaroni salad), with cheese, made with mayonnaise",cup,12.57,25.35,38.27,2.99,2.30,7.63,177.00,454.89
"Pasta salad (macaroni salad), with cheese, made with Italian dressing",cup,10.45,10.22,35.83,7.87,4.03,4.00,138.42,472.12
"Pasta salad (macaroni salad), with ham, made with italian dressing",cup,13.56,18.74,36.85,2.80,2.12,3.23,14.16,669.06
"Pasta salad (macaroni salad), with ham, made with mayonnaise",cup,12.35,25.16,29.72,1.82,2.34,5.22,23.89,1044.58
Noodle pudding,cup,8.55,10.57,44.59,14.87,2.16,2.36,38.88,99.35
"Somen salad with noodles, lettuce, egg, fish, and pork",cup,21.28,10.74,27.95,2.18,1.92,2.74,51.20,468.80
"Fried rice, meatless",cup,6.72,4.91,54.43,0.93,1.83,0.90,19.92,642.38
"Fried rice, with chicken",cup,15.58,6.24,55.18,0.95,1.78,1.19,21.78,681.12
"Fried rice, with pork",cup,15.33,7.84,55.18,0.95,1.78,1.95,25.74,669.24
"Fried rice, with beef",cup,15.92,7.66,55.18,0.95,1.78,1.92,21.78,663.30
"Fried rice, with shrimp",cup,13.58,5.48,55.64,0.95,1.78,1.06,47.52,932.58
"Sushi, without vegetables or seafood",cup,2.68,0.25,29.78,1.81,1.30,0.05,4.35,645.21
"Sushi, without vegetables or seafood",piece,0.48,0.04,5.34,0.33,0.23,0.01,0.78,115.70
"Sushi, with vegetables, no seafood",cup,2.92,1.76,29.13,2.66,2.32,0.27,11.62,559.39
"Sushi, with vegetables, no seafood",piece,0.46,0.28,4.56,0.42,0.36,0.04,1.82,87.62
"Sushi, with vegetables and seafood",cup,7.85,1.51,27.60,2.31,1.49,0.28,8.30,617.48
"Sushi, with vegetables and seafood",piece,1.23,0.24,4.32,0.36,0.23,0.04,1.30,96.72
"Sushi, with vegetables, rolled in seaweed",cup,2.92,1.76,29.13,2.66,2.32,0.27,11.62,559.39
"Sushi, with vegetables, rolled in seaweed",piece,0.46,0.28,4.56,0.42,0.36,0.04,1.82,87.62
"Sushi, with seafood, no vegetables",cup,15.02,2.69,22.43,1.36,1.00,0.56,16.60,632.42
"Sushi, with seafood, no vegetables",piece,2.35,0.42,3.51,0.21,0.16,0.09,2.60,99.06
"Sushi, with egg, no vegetables or seafood, rolled in seaweed",cup,10.81,10.41,16.38,1.24,0.66,2.95,44.82,478.05
"Sushi, with egg, no vegetables or seafood, rolled in seaweed",piece,1.69,1.63,2.57,0.20,0.10,0.46,7.02,74.88
"Paella with meat, Spanish style","cup, boneless",40.26,21.45,30.63,1.26,0.92,4.41,51.24,1738.50
"Paella with meat, Spanish style","cup, with bones",30.14,16.06,22.93,0.95,0.69,3.30,38.36,1301.50
"Paella with seafood, Puerto Rican style",cup,17.50,12.60,36.09,2.05,2.07,1.87,78.20,742.87
Pigeon pea asopao ,cup,5.14,6.09,41.37,2.46,1.96,1.03,26.70,918.48
"Rice and beans, cooked with margarine",cup,11.95,11.57,56.09,1.41,10.04,1.60,81.26,468.44
"Rice and beans, cooked without fat",cup,12.52,0.76,58.77,1.48,10.52,0.20,83.65,489.95
"Rice and beans, cooked with butter",cup,12.02,9.87,56.00,1.41,10.04,5.97,83.65,540.14
"Rice and beans, cooked with vegetable oil ",cup,14.48,12.86,59.77,0.46,7.96,1.78,118.64,630.01
"Rice and beans, with tomatoes, cooked with vegetable oil ",cup,11.30,9.69,47.09,1.77,6.55,1.34,107.38,673.12
"Rice and beans, with tomatoes, cooked without fat",cup,9.97,0.65,47.01,2.49,8.60,0.16,81.26,446.93
"Rice and beans, with pork, cooked without fat",cup,20.84,6.12,49.07,1.24,8.60,2.09,78.87,432.59
"Red beans and rice, cooked without fat",cup,8.30,0.67,41.63,3.21,6.88,0.17,48.52,582.41
Hopping John (blackeye peas and rice),cup,15.77,4.12,45.16,3.99,6.72,1.35,40.32,797.44
"Rice and vegetables, no sauce, cooked without fat",cup,4.04,0.46,36.81,1.87,1.55,0.11,29.24,438.60
"Rice and vegetables, no sauce, cooked with margarine",cup,3.94,4.11,35.86,1.82,1.55,0.80,27.52,469.56
"Rice and vegetables, in a tomato-based sauce",cup,5.92,4.14,49.78,3.84,3.30,0.81,35.56,508.00
Rice casserole with cheese,cup,15.71,12.34,46.59,9.71,0.61,7.62,416.16,828.24
Brown rice casserole with cheese,cup,16.65,14.24,44.84,9.93,1.63,8.35,430.44,838.44
"Rice, cooked with coconut milk ",cup,7.14,34.46,53.12,6.68,3.80,30.34,38.00,366.00
"Rice and tomato sauce, cooked with margarine",cup,5.25,3.06,47.99,3.65,1.94,0.61,26.73,1224.72
"Rice and tomato sauce, cooked without fat ",cup,5.32,0.59,48.59,3.68,1.90,0.14,27.12,1212.33
"Rice and tomato sauce, cooked with vegetable oil",cup,5.26,3.54,47.99,3.64,1.87,0.53,26.79,1197.58
"Rice, brown with tomato sauce, cooked without fat ",cup,5.30,1.64,42.45,3.72,4.12,0.32,26.75,1060.66
"Rice, brown with tomato sauce, cooked with vegetable oil",cup,5.24,4.20,42.00,3.68,4.08,0.65,26.47,1049.43
"Rice, brown with vegetables, no sauce, cooked without fat",cup,3.99,1.24,31.92,2.01,3.27,0.24,27.52,383.56
"Rice, brown with vegetables, no sauce, cooked with margarine",cup,3.90,4.37,31.22,1.96,3.10,0.83,25.80,412.80
Grape leaves stuffed with rice,roll,1.28,6.49,7.81,1.57,1.74,0.91,49.84,93.52
Rice croquette,croquette,2.11,4.05,12.38,0.47,0.56,1.06,18.60,256.68
"Stuffed pepper, with meat",portion (1/2 pepper with filling),14.13,23.14,5.97,2.44,1.64,7.25,144.53,432.10
"Stuffed pepper, with rice and meat",portion (1/2 pepper with filling),11.96,16.97,14.57,2.99,1.94,5.33,105.79,481.27
"Stuffed pepper, with rice, meatless",portion (1/2 pepper with filling),5.96,16.43,17.63,2.32,1.79,4.76,132.61,275.65
"Rice pilaf, cooked with vegetable oil",cup,6.78,6.10,49.65,0.99,0.82,0.88,59.74,854.90
"Dirty rice, cooked with butter",cup,10.16,4.38,34.23,1.72,1.19,0.78,29.70,625.68
"Dirty rice, cooked with vegetable oil ",cup,11.14,11.13,38.09,0.41,0.61,1.75,20.81,403.82
"Flavored rice mix, cooked with margarine (Uncle Ben's)",cup,4.23,8.94,44.08,1.70,0.87,1.93,26.16,638.74
"Flavored rice mix, cooked without fat (Uncle Ben's)",cup,4.36,2.92,45.45,1.77,0.87,0.81,26.16,601.68
"Flavored rice mix with cheese (rice au gratin), cooked with margarine",cup,4.37,6.90,28.70,0.55,0.69,2.00,78.20,779.67
"Flavored rice mix with cheese (rice au gratin), cooked without fat",cup,4.46,3.06,29.28,0.55,0.69,1.29,78.20,758.97
"Flavored rice and pasta mix, cooked with margarine (Rice-a-roni, Lipton)",cup,5.23,7.06,37.30,1.18,0.59,1.40,13.72,674.24
"Flavored rice and pasta mix, cooked with butter (Rice-a-roni, Lipton)",cup,5.34,6.84,34.31,1.79,1.47,4.08,47.39,555.82
"Flavored rice and pasta mix, cooked without fat (Rice-a-roni, Lipton)",cup,5.43,0.67,38.63,1.22,0.59,0.20,13.72,637.00
"Flavored rice and pasta mix, cooked with vegetable oil (Rice-a-roni, Lipton)",cup,5.29,7.82,34.35,1.78,1.48,1.55,45.89,518.78
"Spanish rice, cooked with vegetable oil",cup,7.00,6.15,48.14,3.65,2.19,1.18,48.60,763.02
"Spanish rice, cooked with margarine",cup,4.66,2.49,40.74,6.84,2.96,0.46,79.61,752.91
"Spanish rice, cooked with butter",cup,4.67,3.16,40.74,6.85,2.96,1.76,79.70,746.14
Tabbouleh (bulgar with tomatoes and parsley),cup,2.62,14.96,15.50,2.16,3.68,2.08,32.00,796.80
"Wrap sandwich, filled with chicken, vegetables, and rice",sandwich,41.78,20.44,79.54,7.62,6.50,7.27,138.56,1164.77
"Wrap sandwich, filled with vegetables and rice (vegetarian wrap)",sandwich,13.37,19.43,80.60,9.82,8.08,7.75,137.36,1062.52
"Wrap sandwich, filled with vegetables (vegetarian wrap)",sandwich,8.49,16.24,38.27,8.41,4.10,7.82,125.58,537.81
"Wrap sandwich, filled with chicken, vegetables, rice, and cheese",sandwich,42.78,26.48,86.02,7.29,7.47,10.56,238.16,1424.32
Lasagna with cheese and sauce (diet frozen meal),meal (11 oz),18.13,15.63,54.85,7.21,4.68,5.64,318.24,1145.04
Lasagna with cheese and sauce (diet frozen meal),Lean Cuisine meal (10 oz),16.50,14.23,49.92,6.56,4.26,5.13,289.67,1042.24
Vegetable lasagna (frozen meal),Stouffer's meal (10.5 oz),15.79,23.33,42.85,4.83,5.07,8.14,265.22,879.10
Zucchini lasagna (diet frozen meal),Lean Cuisine meal (11 oz),17.72,10.05,39.03,7.89,4.06,5.07,368.16,951.60
Zucchini lasagna (diet frozen meal),Light and Elegant meal (11.25 oz),18.12,10.27,39.91,8.07,4.15,5.19,376.41,972.92
Zucchini lasagna (diet frozen meal),Weight Watchers meal (11 oz),17.72,10.05,39.03,7.89,4.06,5.07,368.16,951.60
Zucchini lasagna (diet frozen meal),Lean Cuisine meal (10 oz),16.07,9.11,35.40,7.16,3.68,4.60,333.94,863.15
Macaroni and cheese (diet frozen meal),meal (9 oz),15.78,10.05,43.37,4.18,2.04,5.92,285.59,634.93
"Spaghetti with beef in tomato-based sauce, lowfat, reduced sodium (diet frozen meal)",Healthy Choice,13.23,2.65,39.93,6.81,4.72,0.92,47.16,623.56
Noodles with vegetables in tomato-based sauce (diet frozen meal),meal (10 oz),10.37,4.43,29.42,6.82,4.26,2.05,161.87,360.67
"Rice, with broccoli, cheese sauce (frozen side dish)",cup,6.45,7.05,29.00,1.44,2.57,2.73,107.73,581.40
"Rice, with broccoli, cheese sauce (frozen side dish)",side dish (4.5 oz),4.83,5.27,21.71,1.08,1.92,2.04,80.64,435.20
Spaghetti with meat and mushroom sauce (diet frozen meal),meal (11.5 oz),19.98,9.13,53.63,8.61,4.56,2.87,55.42,1339.82
Spaghetti with meat sauce (diet frozen meal),meal (10.5 oz),15.05,3.01,45.42,7.75,5.36,1.04,53.64,709.24
"Ravioli, cheese-filled, with tomato sauce (diet frozen meal)",meal (9 oz),17.57,10.53,31.01,6.15,2.55,5.65,372.29,933.26
Rigatoni with meat sauce and cheese (diet frozen meal),meal (9.75 oz),17.36,10.29,23.68,7.01,3.04,3.94,143.51,844.53
"Ravioli, cheese-filled, with vegetable and fruit (frozen meal)",meal (8.75 oz),6.70,7.69,42.95,20.91,3.47,3.17,74.40,793.60
Pasta with vegetable and cheese sauce (diet frozen meal),Weight Watchers meal (9.25 oz),13.70,7.47,41.82,2.62,3.93,3.15,217.46,571.16
"Beef enchilada, chili gravy, rice, refried beans (frozen meal)",meal (15 oz),21.59,17.51,70.72,1.87,8.93,5.53,144.50,1806.25
"Beef enchilada, chili gravy, rice, refried beans (frozen meal)",Banquet meal (11 oz),15.85,12.85,51.92,1.37,6.55,4.06,106.08,1326.00
Chicken enchilada (diet frozen meal),meal (8.5 oz),26.41,15.23,27.96,5.28,2.89,8.43,344.63,978.46
Sausage and french toast (frozen meal),meal (6.5 oz),21.22,20.64,34.59,10.14,1.29,6.24,143.52,829.84
Pancakes and sausage (frozen meal),meal (6 oz),15.06,23.29,47.12,16.34,1.02,6.04,81.60,975.80
Pancakes and sausage (frozen meal),Jimmy Dean Flapstick,4.43,6.85,13.86,4.80,0.30,1.78,24.00,287.00
Barley soup,cup,3.54,1.90,7.12,0.20,0.73,0.45,21.96,580.70
Beef noodle soup,cup,4.76,3.05,8.86,2.54,0.73,1.13,19.52,812.49
Beef rice soup,cup,9.57,2.68,24.29,1.61,1.45,1.34,31.33,814.58
"Beef noodle soup, home recipe",cup,17.49,5.76,11.22,1.42,0.98,1.69,34.16,792.97
Chicken noodle soup,cup,3.16,2.36,7.35,0.65,0.48,0.66,14.46,829.04
"Chicken noodle soup, canned, low sodium, ready-to-serve",cup,3.12,2.34,7.26,0.66,0.49,0.64,14.76,425.56
"Chicken noodle soup, home recipe",cup,13.69,4.39,11.88,2.27,0.96,0.76,26.51,790.48
"Chicken noodle soup, cream of",cup,7.18,4.70,13.33,6.91,0.49,2.08,156.80,882.00
"Chicken noodle soup, canned, reduced sodium, ready-to-serve",cup,7.83,3.19,9.14,0.81,1.90,0.94,26.18,442.66
Chicken rice soup,cup,2.22,1.88,13.98,0.29,1.21,0.45,53.02,783.25
"Chicken or turkey rice soup, home recipe",cup,12.36,3.79,13.07,1.96,0.69,0.61,23.10,753.06
